{
	"$schema": "../../Aurora.card.schema.json",
	"id": "CAP-004",
	"card_type": "Capability",
	"name": "Maintain Audit Trail",
	"description": "Maintain an append-only audit log per mission (`AuditLog.ndjson`) with grouped card/link changes.",
	"links": [
		{
			"relationship": "requires",
			"target": "PRO-004"
		}
	]
}
