{
	"$schema": "../../schemas/Aurora.card.schema.json",
	"id": "STA-900",
	"card_type": "State",
	"name": "Start state",
	"description": "State used to exercise state transitions, predicate evaluation, and event handling.",
	"links": [
		{
			"relationship": "transitions to",
			"target": "STA-901"
		},
		{
			"relationship": "triggers",
			"target": "PRD-900"
		},
		{
			"relationship": "triggers",
			"target": "EVT-900"
		}
	]
}
