{
	"$schema": "../../schemas/Aurora.card.schema.json",
	"id": "SYS-900",
	"card_type": "System",
	"name": "Example system",
	"description": "A top-level system used to exercise System->Application integration.",
	"links": [
		{
			"relationship": "has",
			"target": "DEP-900"
		},
		{
			"relationship": "involves",
			"target": "DSR-900"
		},
		{
			"relationship": "integrates",
			"target": "APP-900"
		},
		{
			"relationship": "involves",
			"target": "VND-900"
		}
	]
}
