{
	"$schema": "../../schemas/Aurora.card.schema.json",
	"id": "REQ-006",
	"card_type": "Requirement",
	"name": "Audit Log Semantics",
	"description": "Each mission MUST have an append-only `AuditLog.ndjson` audit log where each line records one change event with timestamp, editor, and a list of changed cards (including link changes when applicable).",
	"links": [
		{
			"relationship": "requires",
			"target": "CAP-004"
		}
	]
}
