{
	"$schema": "../../schemas/Aurora.card.schema.json",
	"id": "FEA-004",
	"card_type": "Feature",
	"name": "Editor Model Operations",
	"description": "Provide model operations (discover/load/validate/render/export and CRUD) to the editor UI with trust gating.",
	"links": [
		{
			"relationship": "realizes",
			"target": "CAP-001"
		},
		{
			"relationship": "realizes",
			"target": "CAP-002"
		},
		{
			"relationship": "realizes",
			"target": "CAP-003"
		},
		{
			"relationship": "realizes",
			"target": "CAP-004"
		}
	]
}
