{
	"$schema": "./schemas/Aurora.card.schema.json",
	"id": "MIS-002",
	"card_type": "Mission",
	"name": "Example Canonical Coverage Model",
	"description": "Example Aurora model that exercises every canonical card type, subtype, and relationship defined in the model configuration registry.",
	"links": [
		{
			"relationship": "establishes",
			"target": "DRI-900"
		},
		{
			"relationship": "has",
			"target": "STK-900"
		},
		{
			"relationship": "has",
			"target": "STK-901"
		},
		{
			"relationship": "has",
			"target": "STK-902"
		},
		{
			"relationship": "has",
			"target": "STK-903"
		},
		{
			"relationship": "has",
			"target": "STK-904"
		},
		{
			"relationship": "necessitates",
			"target": "SYS-900"
		},
		{
			"relationship": "remediates",
			"target": "THM-900"
		}
	]
}
